{"schema_version":"1.0.0","artifact_kind":"inventory-bootstrap-audit-barrier","run_id":"d1-fixture-run","sheet_producer_attempt":3,"writer_attempt":1,"audit_attempt":1,"terminal_state":"PASS","correction_count":0,"exit_reason":"audit_passed","audit_artifact":{"path":"runs/d1-fixture-run/audit-attempt-1.md","sha256":"aaaaaaaaaaaaaaaaaaaaaaaaaaaaaaaaaaaaaaaaaaaaaaaaaaaaaaaaaaaaaaaa","size":101}}
