{"schema_version":"1.0.0","artifact_kind":"inventory-bootstrap-audit-barrier","run_id":"d1-correction-run","sheet_producer_attempt":3,"writer_attempt":2,"audit_attempt":2,"terminal_state":"PASS","correction_count":2,"exit_reason":"bounded_corrections_verified","audit_artifact":{"path":"runs/d1-correction-run/audit-attempt-2.md","sha256":"cccccccccccccccccccccccccccccccccccccccccccccccccccccccccccccccc","size":202}}
